年级,学期,学科,课程号,标题,关键词
初三,下,英语,1,Unit 1 The Land and the People,Geography and land features|Countries and cities|A diversity of peoples
初三,下,英语,2,Unit 2 Science and Discoveries,Science in the future|Science in nature|Organic farming|Cloning
初三,下,英语,3,Unit 3 The Life of Plants,Plants|Relationship between plants and people|Trees|A carnivorous plant
初三,下,英语,4,Unit 4 Changes and Reactions,Biology|Physics|Chemistry
初三,下,英语,5,Unit 5 Appreciation and Participation,Beijing opera|Local operas|Drama
初三,下,英语,6,Unit 6 News and the Media,Newspapers and television and radio|Headlines and other pages|News stories and reports|Agencies and newspapermen

